{
  "id": "550e8400-e29b-41d4-a716-446655440012",
  "format_version": "1.0.0",
  "operation_identity": {
    "call_site": "synthetic.fixture.upload"
  },
  "inputs": {},
  "outputs": {},
  "side_effects": [],
  "resource_dependencies": [
    {
      "identity": "synthetic-logical-store",
      "permissions": [],
      "configuration": {},
      "known_behavior": {
        "ordering": "Synthetic fixture declaration for ordering; not provider evidence.",
        "consistency": "Synthetic fixture declaration for consistency; not provider evidence.",
        "failure": "Synthetic fixture declaration for failure; not provider evidence."
      },
      "unresolved_assumptions": [
        {
          "behavior": "retry",
          "assumption_id": "retry-unmeasured",
          "description": "Retry behavior has not been established for this synthetic dependency.",
          "reason": "No approved workload/provider qualification has run."
        }
      ]
    }
  ],
  "obligations": [
    {
      "obligation_id": "upload-object",
      "behavioral_fidelity": "equivalent-within-contract",
      "evidence_refs": [
        "550e8400-e29b-41d4-a716-446655440001"
      ]
    }
  ]
}
